{
  "schema_version": "portfolio-outcome-history.t15",
  "input_mode": "RECORDED",
  "provider_history_state": "NOT_EVALUATED",
  "pages": [
    {
      "request_cursor": null,
      "next_cursor": "page-2",
      "execution_lineages": [
        {
          "execution_lineage_id": "31111111-1111-4111-8111-111111111111",
          "outcome_lineage_id": "41111111-1111-4111-8111-111111111111",
          "account_ref_hash": "hmac-sha256:v1:0123456789abcdef0123456789abcdef0123456789abcdef0123456789abcdef",
          "instrument_id": "aaaaaaaa-aaaa-4aaa-8aaa-aaaaaaaaaaaa",
          "side": "SELL",
          "slice_candidate_ids": ["21111111-1111-4111-8111-111111111111"],
          "candidate_id": null,
          "orders": [
            {
              "broker_order_id": "order-unique-canceled",
              "supersedes_broker_order_id": null,
              "state": "CANCELED",
              "created_at": "2026-08-01T13:34:00.000Z"
            },
            {
              "broker_order_id": "order-unique-reordered",
              "supersedes_broker_order_id": "order-unique-canceled",
              "state": "FILLED",
              "created_at": "2026-08-01T13:42:00.000Z"
            }
          ],
          "fills": [
            {
              "broker_order_id": "order-unique-canceled",
              "broker_fill_id": "fill-unique-partial-1",
              "executed_at": "2026-08-01T13:40:00.000Z",
              "price": "100.000000",
              "quantity": "4.000000"
            },
            {
              "broker_order_id": "order-unique-reordered",
              "broker_fill_id": "fill-unique-partial-2",
              "executed_at": "2026-08-01T13:45:00.000Z",
              "price": "100.500000",
              "quantity": "6.000000"
            }
          ]
        }
      ]
    },
    {
      "request_cursor": "page-2",
      "next_cursor": null,
      "execution_lineages": []
    }
  ]
}
